{
  "schema_version": "1.0",
  "plan_source": "starter/src/pages/play/__docs__/architecture.md (Stack greybox, no separate plan)",
  "target_dir": "fresh copy made by scripts/create-wireframe.mjs",
  "level": "PLAYABLE_GREYBOX",
  "ecs": "required",
  "simulated": [],
  "checks": {
    "install": { "status": "PASS", "command": "npm ci", "evidence": "2026-09-23, macOS, Node 26.7.0" },
    "typecheck": { "status": "PASS", "command": "npm run typecheck" },
    "lint": { "status": "N/A", "reason": "starter ships no ESLint; host repo lint applies after adoption" },
    "fsd": {
      "status": "PASS",
      "command": "npm run check:fsd",
      "evidence": "steiger 0.6.0 + @feature-sliced/steiger-plugin 0.7.0; violation fixture reports forbidden-imports and no-public-api-sidestep"
    },
    "headless": { "status": "PASS", "command": "npm test", "evidence": "34 node:test cases" },
    "build": {
      "status": "PASS",
      "command": "vite build",
      "evidence": "one 536 kB chunk (135 kB gzip), mostly three.js; Vite size warning left visible"
    },
    "browser": {
      "status": "PASS",
      "command": "npm run test:e2e",
      "evidence": "Playwright 1.63.0, Pixel 7 profile on headless Chromium; 3 scenarios"
    },
    "device": { "status": "NOT_RUN", "reason": "no physical phone session" },
    "usability": { "status": "NOT_RUN", "reason": "no participants" },
    "fun": { "status": "NOT_RUN", "reason": "no playtest" },
    "business": { "status": "N/A", "reason": "prototype has no business scope" }
  },
  "ready_to_run": true,
  "open_risks": [
    "Tap-to-drop latency and camera readability are unmeasured on real devices.",
    "Speed curve and perfect tolerance are tuning guesses."
  ]
}
